"text","likes","comments","shares"
"Taiwan dispatched coast guard boats to join a rescue mission at China's request after a fishing vessel capsized near the Taiwan-controlled Kinmen islands, amid heightened tension in the sensitive Taiwan Strait https://reut.rs/3VpiJZ0","3","1","1"
"Croatia's historic city of Dubrovnik aims to lure back locals priced out by high tourist prices with a plan next month that includes banning new private rental permits, following the example of other popular destinations across Europe.","11","5","1"
"As Senegal holds a delayed election on March 24, with President Macky Sall stepping down after two terms, these are some of the main issues likely to be on voters' minds 👇 https://reut.rs/3TCbSuj","5","4","2"
"Exclusive: Citigroup is investigating workplace harassment allegations made by at least one employee against a senior US banker who works on IPOs, four people with direct knowledge of the matter told Reuters.","4","6","0"
"Research in the expanding field of space medicine has identified many ways in which a microgravity environment and other factors can meddle with the human body during space missions. A new study has added to the field by showing that astronauts are more likely to experience headaches in space than previously known.","15","6","2"
"Italy's competition watchdog has fined three units of social media giant TikTok 10 million euros ($10.94 million) in total for inadequate checks on content potentially harmful to young or vulnerable users, it said on Thursday.","23","2","2"
"South Korean researchers have grown beef cells in rice grains in what they say is a major step towards achieving a sustainable, affordable and environmentally friendly source of protein that could replace farmed cattle for meat.","166","51","38"
"Indian digital payments firm Paytm, formally known as One 97 Communications , was on Thursday granted a third-party application provider license by the country's payments authority, which will enable it to facilitate payments after its banking unit ceases operations.","40","7","6"
"‘The Cold War is back,’ one intelligence historian told Reuters, after learning of a covert CIA program involving waging secret propaganda operations against China https://reut.rs/43g4XKi","60","17","10"
"SpaceX's Starship rocket, designed to eventually send astronauts to the moon and beyond, completed nearly an entire test flight on its third try on Thursday, making it farther than before through a cruise in low orbit but was destroyed during atmospheric re-entry, the company said.","124","52","15"
"The U.S. Department of Energy plans to lend Lithium Americas LAC.N up to $2.26 billion to build Nevada's Thacker Pass lithium project, in what will become North America's largest source of the electric vehicle battery metal, the company said on Thursday.","27","3","3"
"Some election experts say electoral trusts contribute to opacity around the funding of political parties in India, where this year’s general election – due to be called within weeks – is expected to return Modi to power for a rare third term ","7","0","1"
"HomeTown Services, a heating and cooling repair company in Tulsa, Oklahoma, is getting ready to install driver monitoring cameras in some of its trucks, and already uses streamed data to remind drivers not to sit too long in idle vehicles, wasting gasoline.","20","2","4"
"An Australian computer scientist who claims he invented bitcoin is not 'Satoshi Nakamoto,' the pseudonymous inventor of the cryptocurrency, a judge at London's High Court ruled.","10","2","1"
"Donald Trump's lawyers are set to ask a federal judge to dismiss the federal criminal case that accuses him of illegally holding onto classified documents, arguing that he is allowed to keep the records after leaving the presidency.","142","60","8"
"SpaceX's Starship rocket, designed to eventually send astronauts to the moon and beyond, completed nearly an entire test flight on its third try, making it much farther than before with a cruise through low orbit before being destroyed during a return to Earth, the company said.","66","12","5"
"Hyundai Motor Co and sister company Kia Corp will recall about 170,000 electric vehicles (EVs) in South Korea over problems with software in the charging systems, South Korea's transport ministry said on Thursday.","16","1","1"
"A major internet disruption hit West and Central Africa on Thursday, the internet observatory Netblocks said, citing reports from operators of multiple subsea cable failures.","22","3","8"
"LIVE: Concorde jet returns to the Intrepid Museum after being refurbished

The British Airways Concorde supersonic jet travels along the Hudson River to return to the Intrepid Museum after being refurbished.

#Concord #BA #BritishAirways #Intrepid #jets #aviation #museum

Keep up with the latest news from around the world: https://www.reuters.com/","223","3","54"
"MicroStrategy has opted to raise capital through convertible bonds offering for the second time in less than 10 days to further increase its exposure to booming bitcoin.","58","16","6"
"Vietnam's foreign ministry on Thursday said international law and the rights and interests of other countries must be respected, responding to a question about China's demarcation earlier this month of a baseline in the Gulf of Tonkin.","40","7","8"
"🔊 Ukraine drones hit some of Russia's biggest oil refineries disrupting production. For the latest listen to the Reuters World News daily podcast https://reut.rs/3IzPBqD","330","65","20"
"U.S. retail sales rebounded in February, driven by increases at auto dealerships and gasoline service stations, but consumer spending is slowing as households grapple with inflation and higher borrowing costs.","27","11","4"
"Wall Street's main indexes opened slightly higher on Thursday, as investors stuck to bets of the Federal Reserve easing interest rates in the coming months after data showing hotter-than-expected inflation and weaker-than-expected consumer spending.","22","5","5"
"Biopharmaceutical company Biocon's unit Biocon Biologics will sell its Indian branded formulations businesses to Eris Lifesciences in a deal worth 12.42 billion rupees ($150 million), the companies said in separate exchange filings on Thursday.","23","5","0"
"Cisco Systems won unconditional EU antitrust approval for its $28 billion bid for cybersecurity firm Splunk on Wednesday after EU regulators said they did not see any competition issues.","21","3","2"
"🔊 The US House passes a bill that could ban TikTok if its Chinese owner ByteDance doesn't divest. Hear from a worried TikTok user who depends on the platform for his livelihood on the Reuters World News daily podcast https://reut.rs/3vanR8L","51","17","6"
"UBS's rescue takeover of Credit Suisse a year ago has created ""new risks and challenges"" for the Swiss economy, the Organisation for Economic Cooperation and Development said on Thursday, the latest international forum to raise concerns about the deal.","12","1","4"
"🔊 What you need to know today:

- The political risk from a US TikTok ban
- The covert CIA program against China
- Ukraine drones attack Russian oil refineries https://reut.rs/3ICFwsX","30","4","5"
"A look at the day ahead in U.S. and global markets from Mike Dolan","15","3","3"
"From Breakingviews - Buyout firms have an even bigger problem than finding a place to park fleets of armored cars heaving with cash: what to do about their idling truckloads of portfolio companies. The two main avenues for returning money to increasingly itchy investors are largely blocked. To get around them, the existing owners are going down the road of cashing out backers while keeping assets. The problem is that","27","2","6"
"LIVE:  Donald Trump expected to attend hearing seeking dismissal of classified documents case

Live coverage outside a Florida court as U.S. District Judge Aileen Cannon holds a hearing on former President Donald Trump's arguments that he was allowed to possess sensitive documents at his Florida resort after leaving the White House.

#Trump #DonaldTrump #election2024 #legal #Florida","58","0","13"
"LIVE: SpaceX expects to launch Starship test flight

The SpaceX Starship, a futuristic vehicle designed to eventually carry astronauts to the moon and beyond, was poised for a third uncrewed test launch on Thursday that the company hopes will carry it farther than before, even if it ends up exploding once again in flight.

#SpaceX #space #Starship #live #news #reuters","989","0","511"
"How long can Nvidia and its CEO, Jensen Huang, wear the crown as the tech world's dominant supplier of artificial-intelligence chips?","38","3","13"
"German container shipper Hapag-Lloyd said global vessel oversupply and a crisis in the Red Sea will force it to cut expenses in 2024 and could reduce sailings, after it posted a 83% fall in net profit in 2023 https://reut.rs/3IzsMmO","25","5","10"
"🔊 In 2019 Trump authorized a covert operation to turn public opinion in China against the government. Find out more on the Reuters World News daily podcast https://reut.rs/49MtLfo","67","59","10"
"Apple-supplier Foxconn said it expects revenue to increase significantly in 2024 following a slow start to the year amid booming demand for AI servers, after it posted fourth-quarter profit that beat market estimates https://reut.rs/4ciOKIj","25","2","3"
"The highest bid received in a U.S. auction of shares that will decide the fate of Venezuela-owned oil refiner Citgo Petroleum was $7.3 billion, enough to cover only a third of court-approved claims, two people familiar with the matter said.","16","1","3"
"From Breakingviews - Markus Krebber is not getting much credit for greening Germany’s biggest power company. The chief executive of $26 billion RWE has seen his share price fall by nearly 25% this year, and at 5 times expected 2024 EBITDA what should be a transition star is valued as lowly as an oil company. Yet two of his three main headaches may soon dissipate, and Krebber can also do more to fix the other one.","37","7","5"
"View from a tent camp in Rafah, where may Palestinians are taking refuge.  Washington has said it would not support an Israeli military operation in Rafah that does not protect civilians noting that the White House has yet to see a credible plan to do so.
 
#Israel #Hamas #Gaza #Palestinian #IsraelHamasWar #GazaWar #live #Reuters #News
Keep up with the latest news from around the world: https://www.reuters.com/","158","0","31"
"Volkswagen on Thursday held out the prospect of launching an entry-level electric vehicle by 2027, with VW brand chief Thomas Schaefer saying the company would decide in coming weeks which model to move forward with.","41","8","3"
"Britain's government outlined plans to stop foreign states from owning newspapers, potentially giving ministers the power to block Abu Dhabi-backed RedBird IMI's bid to buy the Telegraph ","32","3","6"
"Private equity firm KKR has launched a 2.8 billion-euro ($3.06 billion) takeover offer for German electricity and energy producer Encavis , the company said on Thursday.","36","6","10"
"Two years into office, then President Donald Trump authorized the CIA to launch a clandestine campaign on Chinese social media to try to turn public opinion against the government of China, according to former US officials ","169","66","23"
"A government-appointed panel on Thursday recommended India hold elections to state assemblies and the national parliament at the same time, saying the process would increase transparency and inclusivity and improve governance and growth.","16","5","2"
"Nissan Motor is considering seeking a business partnership with Honda Motor, according to media reports, while the Nikkei business daily said they could collaborate on electric vehicles https://reut.rs/3TBmMjV","68","14","14"
"Giant sequoias, the largest trees on Earth, are thriving in Britain, growing at a rate nearly equivalent to those found in their native range in the US state of California https://reut.rs/43fPyK6","118","5","18"
"China's Tencent has taken over two ByteDance video games units after ByteDance retreated from the gaming business last year, according to a person familiar with the matter.","32","2","7"
"If President Joe Biden keeps his promise to sign a ban on TikTok over its ties to the Chinese government, the 81-year-old may rob his reelection campaign of a platform that he and fellow Democrats rely on to reach younger voters.","116","95","24"
"Exclusive: Chinese wheat importers have canceled or postponed about one million metric tons of Australian wheat imports, trade sources with direct knowledge of the deals said, as growing world stockpiles drag down prices ","20","2","4"
"Anheuser-Busch InBev's shares were suspended from trading on Thursday at the request of Belgium's Financial Services and Markets Authority (FSMA) following the news tobacco giant Altria would sell down its stake in the brewer.","38","5","8"
"The US House of Representatives overwhelmingly passed a bill that would give TikTok's Chinese owner ByteDance about six months to divest the US assets of the short-video app, or face a ban, in the greatest threat to the app since the Trump administration ","42","17","7"
"An American Airlines flight landed safely at the Los Angeles airport on Wednesday after the pilot reported a possible mechanical issue, the airline said in a statement on Thursday.","124","39","14"
"British oil major Shell's CEO Wael Sawan's total pay package in 2023 was 7.9 million pounds ($10.11 million), including an annual bonus of 2.7 million pounds, its annual report showed on Thursday.","76","31","11"
"Airline executives are frustrated with Boeing as its safety crisis has upended their business plans. But in a tight market for large aircraft supplied by two companies, they have little choice but to do business with the US planemaker ","26","6","3"
"Australian bookmaker Tabcorp Holdings said on Thursday its CEO Adam Rytenskild resigned after the board became aware of the top boss using ""offensive"" and ""inappropriate"" language at the workplace.","27","2","4"
"Drugmaker AstraZeneca said on Thursday it would acquire rare endocrine diseases-focused firm Amolyt Pharma for $1.05 billion in cash, in a bid to boost its rare diseases portfolio.","20","3","6"
"Shell weakened its 2030 carbon reduction target and scrapped a 2035 objective, citing expectations for lower power sales and strong demand for gas in the energy transition even as it affirmed a plan to cut emissions to net zero by 2050.","26","1","4"
"So many voters across the Congo reported smudged, illegible ID cards that the government announced, one week before the election, that people could vote without them ","32","2","10"
"Chinese wheat importers have cancelled or postponed about one million metric tons of Australian wheat imports, trade sources with direct knowledge of the deals said, as growing world stockpiles drag down prices.","40","7","12"
"A look at the day ahead in European and global markets from Rae Wee","45","9","10"
"The Russian-controlled management of the Zaporizhzhia nuclear power plant, the largest in Europe, said that the Ukrainian army had shelled a critical infrastructure facility at the plant ","94","27","12"
"There is ‘no fairness to speak of’ in citing national security to reduce the competitive advantage of other countries, a spokesperson of the Chinese foreign ministry said, criticizing a US bill to force a TikTok divestiture or ban ","32","22","5"
"Oracle said it is adding generative artificial intelligence features across its corporate software lineup, intensifying competition with Microsoft and other technology firms to sell the technology to businesses customers ","52","6","17"
"China's central bank is expected to leave a key policy rate unchanged when it rolls over maturing medium-term loans on Friday, a Reuters survey showed, amid uncertainty over the timing of expected Federal Reserve interest rate cuts.","25","2","4"
"A prolonged slump in newspaper sales has forced thousands of iconic news kiosks to pull down their metal shutters for one last time across Italy ","46","1","11"
"Temperatures are expected to soar again in the European summer, after setting records in 2023, but there will be no air conditioning in the Olympic athletes' rooms at #Paris2024, which has pledged to host the ‘greenest ever’ Games ","23","1","5"
"An assault on Leonid Volkov, a top aide to the late Alexei Navalny, in Vilnius was professional and well planned, the head of Lithuania's governmental crisis management center said according to local media ","38","6","9"
"A prolonged slump in newspaper sales has forced Fabiano Pompei and Marco Volpini to close their respective news kiosks - like thousands of others across Italy https://reut.rs/4ae6q62","32","1","14"
"A magnitude 5.4 earthquake struck the mountainous region in western Montenegro early on Thursday, the US Geological Survey (USGS) said.","38","2","12"
"Switzerland's lower house of parliament clearly passed a motion to make senior management of a major bank return half their income over the previous decade if the lender has to be rescued with public money ","19","2","6"
"The Russian-controlled management of the Zaporizhzhia nuclear power plant, the largest in Europe, said that the Ukrainian army had shelled a critical infrastructure facility at the plant ","98","44","17"
"Japan's bar on same-sex marriage is unconstitutional, the high court in the northern region of Sapporo said, the first such ruling by an appeals court on a matter that has divided the lower levels of the judiciary ","59","7","9"
"Eight of India's biggest business groups donated at least $50 million in total between 2019 and 2023 to the Prudent Electoral Trust, which issued cheques for corresponding amounts to India’s ruling Bharatiya Janata Party, according to a @Reuters analysis ","16","1","5"
"Apple supplier Foxconn said on Thursday it expects revenue to increase significantly in 2024 following a slow start to the year amid booming demand for AI servers, after it posted fourth-quarter profit that beat market estimates.","38","2","4"
"The Philippine's former first lady Imelda Marcos is set to leave hospital on Thursday, after suffering from fever and a slight pneumonia, her son President Ferdinand Marcos Jr. said.","40","1","17"
"Chinese electric vehicle maker Nio has completed 40 million battery swaps so far, CEO William Li said on Thursday, replacing depleted batteries with fully charged packs, rather than plugging the vehicle into a charging point.","98","28","16"
"A Reuters investigation suggests chocolate makers are facing trouble as cocoa plants in Africa halt operations. Here’s what you need to know about the potential global shortage and price increase for chocolate https://reut.rs/3VA2MQb","26","4","8"
"India's small- and mid-caps rose on Thursday, while the blue-chips were little changed, with the market taking a breather after tumbling in the previous session on worries about the results of a stress test on certain mutual funds schemes.","47","4","3"
"Security camera footage that may show who worked on the door plug which blew off an Alaska Airlines Boeing 737 MAX on Jan. 5 has been overwritten, according to a letter by NTSB Chair Jennifer Homendy to US senators https://reut.rs/3VhjymD","47","6","4"
"Singapore Telecommunications (Singtel) shares fell more than 1% on Thursday in early trade after reports it was in advanced negotiations to sell a significant stake in Australian telco Optus to Canada's Brookfield Asset Management .","45","4","7"
"Thailand's former Prime Minister Thaksin Shinawatra arrived by private jet to visit his northern hometown of Chiang Mai for the first time since fleeing the country after a military coup in 2006 ","32","4","2"
"Europe's private credit funds are increasingly borrowing from banks to boost their performance, fueling concerns about the wider risks posed by this interconnectedness ","31","3","6"
"From Breakingviews - TikTok's Chinese parent is stuck in a Washington doom loop. Four years after then U.S. president Donald Trump tried to ban the popular short-video app, lawmakers on Wednesday passed a bill giving ByteDance six months to divest its American assets or face a ban. It escalates a seemingly endless fight for the privately-held company led by co-founder and CEO Liang Rubo.","25","8","1"
"The FAA on Wednesday granted SpaceX a license to test-launch the company's Starship rocket system from Texas, according to the agency's website, paving the way for another early demonstration of a spacecraft crucial to Elon Musk's satellite launch business and NASA's moon program.","65","11","12"
"Uncertainty hung over Haiti's political future after Prime Minister Ariel Henry said he would step down amid a surge in gang violence. @Reuters spoke with Haitians in the 'Little Haiti' neighborhood of Brooklyn, New York, about the situation https://reut.rs/3TihUP3","20","4","3"
"Millions of vines are being destroyed in Australia and tens of millions more must be pulled up to rein in overproduction that has crushed grape prices and threatens the livelihoods of growers and wine makers https://reut.rs/3Tk8UZQ","48","3","16"
"Germany is midway through a four-year real estate crisis that will lead to more losses and distressed sales of unwanted properties, the head of Commerzbank's real estate business told @Reuters ","36","1","6"
"Airline executives are frustrated with Boeing as its safety crisis has upended their business plans. But in a tight market for large aircraft supplied by two companies, they have little choice but do business with the US planemaker ","27","5","17"
"SpaceX's Starship, a futuristic vehicle designed to eventually carry astronauts to the moon and beyond, was poised for a third uncrewed test launch on Thursday that Elon Musk's company hopes will carry it farther than before ","57","8","6"
"UnitedHealth Group said on Wednesday its unit Change Healthcare's pharmacy network was back online, weeks after a cyberattack had a knock-on effect across the country's healthcare system that depends heavily on insurance.","17","1","3"
"China's top diplomat, Foreign Minister Wang Yi, will visit Australia next week, Prime Minister Anthony Albanese said on Thursday, a sign of a further thaw in relations after years of tensions.","48","5","8"
"Paris mayor Anne Hidalgo said she hoped Russian athletes would be banned from taking part in the #Paris2024 Olympics and their opening ceremony ","132","14","12"
"Police in the Indian capital put up barricades, stepped up security and warned of traffic congestion as thousands of protesting farmers were due to arrive for a rally in support of their demand for higher crop prices ","22","1","2"
"A total of 134 countries representing 98% of the global economy are now exploring digital versions of their currencies, with over half in advanced development, pilot or launch stages. But the United States is falling increasingly behind ","41","9","10"
"From @Breakingviews: Japan's central bank could end an era of negative borrowing costs. In this Viewsroom podcast, Breakingviews columnists @aimeedonnellan, @guerreraf72 and @ugalani argue that many struggling small businesses could hit a wall ","12","0","1"
"Philippine President Ferdinand Marcos Jr. will meet U.S. Secretary of State Antony Blinken on March 19 to tackle cooperation and security matters, the office of the Manila leader said in a statement late on Wednesday night.","66","6","14"
"From Breakingviews - The central bank could end an era of negative borrowing costs as early as next week. In this Viewsroom podcast, Breakingviews columnists argue that large companies are ready for the tightening, but many struggling small businesses could hit the wall even if policymakers go slow.","25","3","5"
"Local government officials in China's Sanhe county, near Beijing, said they had started an investigation into the cause of a massive explosion at a shop selling fried chicken that left 7 dead and 27 injured ","28","3","2"
"Philippine President Ferdinand Marcos Jr. told German Chancellor Olaf Scholz the Hague-based International Criminal Court has no authority to probe his predecessor's deadly war against drugs ","58","11","13"
"Taiwan and China dispatched teams on a rare joint mission to rescue a boat that capsized near Taiwan-controlled Kinmen islands, amid heightened tensions in the sensitive Taiwan Strait ","49","2","8"
"North Korean leader Kim Jong Un guided a military demonstration involving a new battle tank, state media KCNA reported, in the latest show of force by the isolated state as South Korea and the United States wrapped up joint drills ","95","13","8"
"Taiwan and China dispatched teams on a rare joint mission to rescue a boat that capsized near Taiwan-controlled Kinmen islands on Thursday, amid heightened tensions in the sensitive Taiwan Strait.","40","5","3"
"Menopause is a rare trait among Earth's species, known to exist in humans, killer whales and four other toothed whales. New research examines menopause in these whales, with findings that may help explain why this phenomenon evolved ","39","5","4"
"Britain unveiled a new definition of extremism in response to an eruption of hate crimes against Jews and Muslims since the Oct. 7 Hamas attacks on Israel, although critics said the change risked infringing on freedom of speech ","46","22","5"
"A slump in the price of lithium, a key raw material in electric car batteries, is dragging on China's mining of the ultralight metal which together with a costly extraction process is prompting a reassessment of output growth and new project plans ","12","0","3"
