"text","likes","comments","shares"
"🔊 Today on Reuters World News daily podcast:

- Biden admin announces new arms package for Ukraine
- Former US Special Counsel Hur defends his Biden report 
- Sudan army regains control of broadcast HQ 
- A Reuters Investigation into OnlyFans ","12","1","2"
"The U.S. House of Representatives plans to vote on a bill on Wednesday that would give TikTok's Chinese owner ByteDance about six months to divest the U.S. assets of the short-video app used by about 170 million Americans or face a ban.","55","18","7"
"BNP Paribas , the euro zone's largest bank, on Wednesday said it will step up its cost-cutting plans by 400 million euros ($437 million) after posting weak fourth-quarter results last month.","49","4","10"
"Volkswagen expects a 3% rise in its car sales this year, down sharply from 2023 amid a gloomy economic outlook and growing competition.","46","9","1"
"Toyota Motor agreed to give factory workers their biggest pay increase in 25 years, heightening expectations that bumper pay raises will give the central bank leeway to make a key policy shift next week https://reut.rs/4c5O8FU","27","0","4"
"Australia's PSC Insurance said on Wednesday it is in talks regarding a possible buyout after being approached by multiple parties, confirming a local media report.","10","2","0"
"Chinese top copper smelters on Wednesday came to a rare agreement to jointly embark on production cuts at some loss-making plants as they seek to cope with a shortage of raw material, according to sources with knowledge of the plans.","23","1","0"
"Toyota agreed to give factory workers their biggest pay increase in 25 years, heightening expectations that bumper pay raises will give the Bank of Japan leeway to make a key policy shift next week ","30","3","4"
"German sportswear giant Adidas posted its first annual loss in more than 30 years on Wednesday and warned sales in North America would fall again as sportswear retailers in the U.S. battle high inventories.","119","43","22"
"Leonid Volkov, a close associate of the late Russian opposition figure Alexei Navalny, was targeted with tear gas and a hammer outside his residence in Vilnius. Lithuanian authorities have initiated an inquiry into the attack https://reut.rs/3IxYNfd","47","8","7"
"A proposal by global regulators to change how the largest banks report key risk metrics at the end of the year could deal a blow to their U.S. short-term funding businesses, the latest salvo in a battle over tighter capital rules.","28","7","1"
"Barely weeks after Japanese stocks broke three-decade highs, the country's financial markets are hurtling toward another phenomenon not seen for the best part of a generation: rising interest rates.","48","13","9"
"Lithuanian police said they had launched an investigation into an assault on Leonid Volkov, the long-time aide to late Russian opposition leader Alexei Navalny, after he was attacked outside his home in Vilnius ","46","23","4"
"The House of Representatives is set to vote on a bill that would give ByteDance 165 days to divest TikTok or else app stores operated by Apple, Google and others could not legally offer TikTok or provide web hosting services to apps controlled by ByteDance https://reut.rs/3IBNhPQ","22","10","4"
"Singapore Telecommunications , Southeast Asia's largest telcom operator, on Wednesday dismissed a media report that said it was in advanced talks to sell its Australian unit Optus.","44","5","6"
"President Vladimir Putin warned the West that Russia was technically ready for nuclear war and that if the US sent troops to Ukraine, it would be considered a significant escalation of the conflict ","481","294","68"
"Apple made a major concession in its battle to protect the dominance of its App Store on iPhones and other devices in Europe saying developers will be free to distribute their apps directly to consumers https://reut.rs/3vjseOR","37","2","5"
"A look at the day ahead in European and global markets from Tom Westbrook","14","3","2"
"Prisoners in the northern Italian city of Parma are on hunger strike over poor sanitation and overcrowding. Giorgia Meloni's hard-right government has responded by threatening to make even peaceful protesting a criminal offense ","28","8","6"
"Britain's economy returned to growth at the start of 2024, offering some relief to Prime Minister Rishi Sunak ahead of an election expected this year, after it entered a shallow recession in the second half of 2023, official data showed ","29","4","5"
"Spanish retailer Mango is honing in on adaptable clothing to help customers adjust to wild swings in temperature as climate change makes fashion less seasonal, Chief Executive Toni Ruiz told Reuters.","61","1","5"
"Porto manager Sergio Conceicao said Arsenal boss Mikel Arteta insulted his family during the London club's penalty shootout win over the Portuguese side in their Champions League last-16 tie on Tuesday.","71","25","11"
"Kairos, a small, solid-fuel rocket made by Japan's Space One, exploded shortly after its inaugural launch, as the firm tried to become the first Japanese company to put a satellite in orbit https://reut.rs/43cU2B7","99","12","15"
"UK wage data did its best to pull sterling down from a seven-month peak on Tuesday but the economy is showing enough signs of improvement to persuade investors that the Bank of England will still have to keep interest rates higher for longer than its peers.","25","5","7"
"HelloFresh needs to cut costs and stem an exodus of meal-kit subscribers to boost profits and revive its share price, according to investors and analysts, who remain to be convinced by a plan to expand its fledging ready-meals arm ","34","2","5"
"A year ago, Credit Suisse was teetering on the brink of collapse, a scare that sent European bank shares tumbling and the cost of insuring against default soaring. Here are graphics charting the road to recovery, as well as some potential pitfalls ahead ","30","5","10"
"U.S. President Joe Biden sat for hours of questioning with Special Counsel Robert Hur over two days in early October, related to his handling of classified documents.","36","19","6"
"The global real estate industry is scrabbling around for reasons to be optimistic in the grip of its biggest crash in more than a decade, with developers and investors talking up the prospect of a recovery - just not quite yet ","16","1","1"
"Methane emissions from the energy sector remained near a record high in 2023 despite a raft of commitments from the oil and gas industry to plug leaking infrastructure, a report by the International Energy Agency said ","30","7","7"
"Chased by debt collectors over a mortgage delinquency in a southern Chinese city, former finance worker Lei Xiaoyu no longer answers her phone as she tries to delay the inevitable https://reut.rs/4a5Vx6i","26","2","4"
"India this week implemented the Citizenship Amendment Act, sparking sporadic protests and a war of words between Prime Minister Narendra Modi's government and opposition groups. Here is a look at the law, its implications and the concerns surrounding it ","26","1","1"
"Gold prices were flat on Wednesday, after falling the most in a month in the previous session, as sticky U.S. inflation raised concerns an interest rate cut by the Federal Reserve may be delayed beyond June.","18","6","1"
"President Vladimir Putin warned the West that Russia was technically ready for nuclear war and that if the US sent troops to Ukraine it would be considered a significant escalation of the war ","749","534","115"
"India has allowed its central bank to import gold without paying import levies, the government said in a notification issued late on Tuesday.","23","0","3"
"An International Monetary Fund mission is arriving in Pakistan for a second and last review of a $3 billion standby arrangement, two sources said ","24","3","4"
"Indonesian presidential candidate Anies Baswedan said he plans to file a complaint at the country's Constitutional Court over the results of last month's election ","19","2","2"
"Relatives of an autistic boy fatally shot by police while holding a garden tool outside his home are calling for greater transparency by California authorities investigating the incident, the family's lawyer said https://reut.rs/3wSxYzI","54","7","2"
"Britain will on Wednesday sign a memorandum of understanding on trade with Texas, the biggest U.S. state so far to agree to such a pact aimed at boosting investment.","26","10","3"
"⭐ Music icon Lenny Kravitz unveils his new star on the Hollywood Walk of Fame","1024","46","80"
"Intense rains in Argentina are beginning to leave the soil too wet in key agricultural areas, which could also make it harder to harvest the 2023/24 soybean crop, a climate specialist said on Tuesday, though the conditions could be good for the 2024/25 wheat crop.","44","4","5"
"Video from the Orange County Fire Authority shows firefighters and veterinarians teaming up for a horse-rescue operation in Laguna Niguel, California","69","3","5"
"From Breakingviews - China's Xiaomi may have started out as an Apple wannabe but it has now pulled ahead of the American technology titan. The $48 billion handset-maker said it will deliver its first electric car just weeks after the iPhone-maker scrapped a decade-long effort. CEO Lei Jun's timing isn't great but an edge in software will help him.","101","24","10"
"Global sales of fully electric and plug-in hybrid vehicles (PHEVs) rose at a tepid rate of 3% in February versus the same period last year mainly due to the impact of the Chinese Lunar New Year celebrations, market research firm Rho Motion said on Wednesday.","51","11","0"
"Economists have upgraded Singapore's 2024 growth forecast, according to a survey by the country's central bank, with better-than-expected external growth seen as the top upside driver for the economy ","64","3","9"
"CORRECTION: Australian-born surfer Connor O'Leary said he had been selected for the Japan team for the #Paris2024 Olympics, after switching his allegiance to the country of his mother's birth last year. We are deleting a post with an incorrect headline ","42","1","0"
"Rescue teams searched waters in central Indonesia for 24 fishermen missing since their boat sank at the weekend, with hopes kept alive by the discovery a day ago of 11 survivors who had been floating at sea for three days https://reut.rs/3wQc0NR","50","10","1"
"One person was killed and 22 injured when an explosion destroyed a restaurant in Hebei province in China, badly damaging cars and leaving debris scattered on surrounding streets, Chinese state media reported ","43","3","3"
"Cryptocurrency exchange OKX's Singapore subsidiary has received in-principle approval for a payments licence to operate in the city-state, the firm said on Wednesday.","49","7","3"
"PwC Australia said it would cut an additional 329 jobs, part of a major restructuring that follows a national scandal in which a former partner leaked government tax plans ","30","2","2"
"Russia remains in a state of combat readiness and is fully ready for a nuclear war, but not ‘everything is rushing to it’ at present, President Vladimir Putin said in remarks published on Wednesday ","383","199","34"
"Oil prices rose on Wednesday on expectations of strong global demand, including in the world's top consumer the United States, and as even somewhat sticky U.S. inflation did not dent expectations the Fed might start cutting rates soon.","31","2","4"
"The number of children globally who died before their fifth birthday dropped to a record low of 4.9 million in 2022, but that still represents one death every six seconds, according to new United Nations estimates ","27","8","6"
"President Joe Biden and former President Donald Trump both clinched their parties' nomination, kicking off the first US presidential election rematch in nearly 70 years https://reut.rs/3vjEXRA","300","233","25"
"Spending on after-school activities was once par for the course for middle-class Chinese families, but the world's second-largest economy is in the throes of a crisis of confidence that's had an impact on schools and clubs offering sports and music lessons ","19","3","2"
"Hundreds of innocent Post Office branch managers wrongly convicted of theft, fraud and false accounting as a result of flaws in an IT system will be exonerated by landmark legislation introduced on Wednesday, the British government said ","24","5","2"
"Toyota agreed to give factory workers their biggest pay increase in 25 years, heightening expectations that bumper pay raises will give the central bank leeway to make a key policy shift next week ","43","7","5"
"Taiwan's vice president-elect and former de facto ambassador to Washington, Hsiao Bi-khim, is in the United States this week for a private visit, a senior Taiwanese official and a U.S. spokesperson said on Tuesday, a trip China said it ""firmly opposes.""","51","15","6"
"Japan's Space One's small, solid-fueled Kairos rocket exploded shortly after its inaugural launch as the firm tried to become the first Japanese company to put a satellite in orbit ","76","9","8"
"Toyota has agreed to fully meet its union's request for annual pay increases, the Mainichi newspaper said, as top Japanese companies look likely to offer sizeable salary hikes at annual talks with unions ","66","5","4"
"Uncertainty hung over Haiti's political future after its prime minister said he would step down, a move welcomed by many Haitians exhausted by months of escalating gang violence, but with questions over security still not settled ","24","7","3"
"US air carriers warned that their plans to increase capacity were in doubt due to more jet delivery delays from Boeing, as the hit to the airline industry from the planemaker's safety crisis worsens ","31","8","5"
"The US federal judiciary adopted a new policy aimed at curtailing ‘judge shopping’ for the filing of lawsuits challenging government policies in courthouses where one or two sympathetic judges had been virtually guaranteed to hear cases ","52","6","10"
"Japan's Space One's small, solid-fuelled Kairos rocket exploded shortly after its inaugural launch on Wednesday as the firm tried to become the first Japanese company to put a satellite in orbit.","43","7","2"
"A US prosecutor said his investigation of President Joe Biden over his handling of classified documents didn't exonerate the president despite declining to charge him, after setting off a political firestorm by saying Biden had a ‘poor memory’ ","70","42","8"
"Polish Prime Minister Donald Tusk warned US House of Representatives Speaker Mike Johnson that ‘the fate of millions of people’ and ‘thousands of lives’ depends on whether the Republican allows a vote on $60 billion in military aid to Ukraine ","432","182","50"
"President Joe Biden won enough delegates to seal the Democratic Party's nomination, with a face-off against former President Donald Trump looming in what would be the first US presidential election rematch in nearly 70 years ","146","85","10"
"A U.S. appeals court on Tuesday upheld a Texas law requiring family planning clinics to notify parents if their minor children seek birth control and get their consent to provide it.","114","15","12"
"A federal judge in Florida on Tuesday dismissed a lawsuit against Meghan Markle, the wife of Britain's Prince Harry, rejecting claims that the actress had made ""disparaging, hurtful and false"" claims about her half-sister.","75","14","4"
"A growing number of new Reddit users came from search engines like Google, the company says. Anita Ramaswamy explains why it is a risk for the social media platform, as it plans to go public soon.","33","10","5"
"The U.S. House of Representatives plans to vote on a bill on Wednesday that would give TikTok's Chinese owner ByteDance about six months to divest the short-video app used by about 170 million Americans or face a ban.","45","15","9"
"LIVE: Thailand celebrates national elephant day

Thailand celebrates national elephant day by holding a fruit and vegetable feast for dozens of pachyderms at the elephant kraal in the ancient city.

#NationalElephantDay #Elephant #Thailand #live #Reuters #news
 
Keep up with the latest news from around the world: https://www.reuters.com/","241","0","48"
"The US will send a new military aid package for Ukraine worth $300 million, President Joe Biden's administration said, the first such move in months as additional funds for Kyiv remain blocked by Republican leaders in Congress https://reut.rs/4crgPNZ","193","85","22"
"Samsung Electronics plans to use a chip making technology championed by rival SK Hynix, five people said, as the world's top memory chipmaker seeks to catch up in the race to produce high-end chips used to power artificial intelligence.","37","3","9"
"Kenya’s government did an about-face, announcing it was pausing a long-delayed deployment of Kenyan police officers to tackle spiraling violence in Haiti.","43","3","12"
"Data center operator Equinix on Tuesday named Alphabet's Google Cloud executive Adaire Fox-Martin as its CEO, with the appointment effective late next quarter.","43","4","6"
"The police chief of Uvalde, Texas, where a gunman in 2022 invaded a school and killed 19 children and two teachers, said on Tuesday that he was resigning.","60","21","8"
"General Motors said on Tuesday that Mike Abbott, executive vice president of software and services, will step down due to health reasons.","19","3","6"
"Steelmaker ArcelorMittal said on Tuesday it will acquire a 28.4% stake in Vallourec for around 955 million euros ($1.04 billion) to increase its exposure in the tubular business.","38","2","3"
"Canadian prison service officials could not have prevented an inmate who was let out of jail from carrying out the country's worst ever mass stabbing, an official report said on Tuesday.","51","26","7"
"Former US Special Counsel Robert Hur said his investigation of Joe Biden over his handling of classified documents didn't exonerate the president despite declining to charge him, after setting off a political firestorm by saying Biden had a 'poor memory' https://reut.rs/3IBRLG0","60","50","12"
"Kenya has decided to pause its deployment of 1,000 police officers to lead an international security mission in Haiti following Prime Minister Ariel Henry's announcement that he would tender his resignation, a senior Kenyan official said on Tuesday.","21","7","3"
"A Russian missile slammed into two apartment buildings in the central Ukrainian city of Kryvyi Rih on Tuesday, killing three people and injuring at least 38, with rescue teams sifting through rubble late into the night in a search for survivors.","267","100","27"
"Sudan's army said that it claimed its most significant advance of the country's nearly 11-month-old conflict against the paramilitary Rapid Support Forces. A video posted by the army showed some of its troops near the radio and TV building.","42","11","10"
"Late Russian opposition leader Alexei Navalny's long-time aide Leonid Volkov was assaulted with a hammer in the Lithuanian capitol Vilnius, former Navalny spokesperson Kira Yarmysh said.","90","16","11"
"President Joe Biden assured Poland's leaders that US support for Poland is ironclad amid concerns in Europe that Russian President Vladimir Putin will not stop his military aggression at the borders of Ukraine.","313","151","21"
"Argentina's monthly inflation rate slowed down more than expected to come in at 13.2% in February, a boost for libertarian President Javier Milei who is pushing tough austerity to try to tame the world's fastest-rising prices.","24","2","4"
"U.S. natural gas production will decline in 2024 while demand will rise to a record high, the U.S. Energy Information Administration (EIA) said in its Short Term Energy Outlook (STEO) on Tuesday.","27","4","5"
"The U.S. federal judiciary on Tuesday adopted a new policy aimed at curtailing ""judge shopping"" by state attorneys general, activists and companies who file lawsuits challenging government policies in courthouses where one or two sympathetic judges hear most cases.","69","15","16"
"Three Egyptian Coptic monks were killed in a ""criminal assault"" inside a Coptic monastery in South Africa, the Christian Coptic Orthodox Church of Egypt said on Tuesday, and South African police said they were investigating a triple murder.","56","13","9"
"Paris is a long way from Kickstarter's chief executive Everette Taylor's Virginia hometown, but the French capital gets the ‘creative juices flowing’ and offers a work-life balance during a business trip, he says.

Taylor, who’s been at the helm of the crowdfunding platform since 2022, loves the vibrancy and inspiration that Paris embodies and how its residents' lives don't just revolve around work.

For Reuters 48 Hours series, Taylor shares how to best spend a short business trip in the City of Lights.

Read more on how you can make the most of your trip to Paris.","39","9","4"
"A Romanian court has approved a request from Britain to extradite internet personality Andrew Tate but postponed doing so until Romanian trial proceedings finish https://reut.rs/3x1R7is","69","4","3"
"Landing a Big Law summer associate position was tougher in 2023.","18","5","1"
"Republican U.S. Representative Ken Buck will leave Congress at the end of next week, he said on Tuesday, blaming a ""breakdown of civility"" in a chamber led by his party's slim and fractious majority.","342","58","30"
"Tesla's expansion into Southeast Asia is a priority, a senior executive said on Tuesday, highlighting the fast-growing market where the U.S. electric-vehicle maker faces competition from China's BYD.","28","5","0"
"Award-winning Tunisian olive oil producer Mustapha Mtiraoui could make far more money by exporting his produce in labelled bottles, rather than shipping it in bulk.","69","9","22"
"From Breakingviews - People turn to social media site Reddit for advice on topics ranging from baking cookies to legal dilemmas. It posted 20% revenue growth last year, a testament to its posts’ ability to attract advertisers. But despite its popularity, Reddit’s reliance on search engines, specifically Alphabet-owned Google, poses a fundamental risk. Fickle users are expensive to attract, and that keeps Reddit on a c","32","3","3"
"VIDEO CORRECTION: Lufthansa's cabin crew union called on its members to strike at Lufthansa and short-haul carrier CityLine to press their demands for higher pay, seeking a 15% wage increase. We are deleting videos with some missing audio https://reut.rs/3uX6B76","17","1","2"
"Germany on Tuesday launched a bidding process for subsidies to support energy-intensive firms switching to green production in a 4 billion euros ($4.37 billion) funding round, the economy ministry said on Tuesday.","51","8","3"
"Italian company IronLev conducted what it says is the first test of magnetic levitation — or maglev — transport on an existing railway track, a technology that has potential to reduce costs and energy-use as the industry seeks more efficient systems.","216","15","55"
"China could use social media app TikTok to influence the 2024 U.S. elections, U.S. Director of National Intelligence Avril Haines told a House of Representatives intelligence committee hearing on Tuesday.","212","80","22"
"An Olympic tapestry celebrating the 2024 Paris Games, designed by French-Iranian artist Marjane Satrapi, is unveiled in Paris.","26","4","3"
"GE Aerospace said on Tuesday it planned to invest over $650 million into its manufacturing plants and supply chain this year to boost its production capacity to support demand from commercial and defense clients.","50","6","6"
"Wearing matching outfits, Britain's Queen Camilla is presented with a Barbie doll made in her likeness at reception at Buckingham Palace.","147","24","13"
"LIVE: Taraweeh prayer from Mecca

Muslims perform the Tarweeh Taraweeh in the Grand Mosque of Mecca on the second night of Ramadan.
 
#Mosque #Ramadan #Mecca #Tarweeh
 
Keep up with the latest news from around the world: https://www.reuters.com/","2575","2","197"
"U.S. consumer prices increased solidly in February amid higher costs for gasoline and shelter, suggesting some stickiness in inflation that could delay an anticipated June interest rate cut from Federal Reserve.","24","10","3"
"Digital asset manager Grayscale Investments on Tuesday filed for a spin-off of its spot bitcoin exchange-traded fund (ETF), the Grayscale Bitcoin Trust (GBTC) .","43","17","1"
"The charity ship Open Arms, carrying 200 tons of aid for Gaza including a barge containing flour, rice and protein, left Cyprus in a pilot project to open a sea route to help stave off famine https://reut.rs/4a4vP2J","92","117","11"
"LIVE: Pentagon briefing with Air Force Maj. Gen. Pat Ryder

Press Secretary Air Force Maj. Gen. Pat Ryder holds the Pentagon briefing.
 
#LIVE #Pentagon #PatRyder #Haiti #Gaza #IsraelHamasWar #Israel #Ukraine #RussiaUkraineWar #Volodymyrzelensky #Russia #Kyiv #IsraelGazaWar #GazaWar #IsraeliArmy #IsraelWar #Oct7Atack #BreakingNews #TopStories #Livenews #politics #news #Reuters
 
Keep up with the latest news from around the world: https://www.reuters.com/","65","0","17"
"A second straight month of stronger-than-expected inflation has effectively shut the door on the possibility of a Federal Reserve interest-rate cut before June, and makes back-to-back reductions after that look increasingly less likely.","27","13","2"
"Uncertainty hung over Haiti's political future on Tuesday after its prime minister said he would step down, a move welcomed by some Haitians frustrated by months of gang violence, but made without a clear path to stability yet in place.","18","8","3"
