"text","likes","comments","shares"
"Winger Louis Lynagh made himself an instant hero with a try on debut as Italy rallied to secure a famous 31-29 win over Scotland in a dramatic Six Nations clash on Saturday and put a huge dent in their opponents' championship hopes.","30","2","0"
"Pramac Racing's Jorge Martin led from start to finish to win the MotoGP season-opening sprint at the Qatar Grand Prix on Saturday as last season's championship runner-up became the first rider to register 10 sprint victories.","18","2","1"
"Houthi forces targeted the US bulk carrier Propel Fortune in the Gulf of Aden, the group's military spokesman said https://reut.rs/3T8y7GD","795","226","50"
"The 50km women's classic cross-country race in and around Oslo's famous Holmenkollen stadium on Saturday was marred by drunken brawls among the spectators.","40","2","1"
"Harry Kane scored a hat-trick in Bayern Munich's 8-1 demolition of Mainz 05 on Saturday to set a Bundesliga record as the champions cut the gap on leaders Bayer Leverkusen to seven points.","42","2","3"
"Sudan's Rapid Support Forces (RSF) paramilitary group on Saturday welcomed a call by the United Nations Security Council for a cessation of hostilities in the Muslim holy month of Ramadan, offering a potential respite from the 11-month-old conflict.","37","11","6"
"England will go to Ireland in the opening round of the 2025 Six Nations Championship, before home clashes against France and their nemesis Scotland in a tough first three games for Steve Borthwick’s side.","29","2","0"
"Bruno Fernandes and Marcus Rashford fired in penalties to give Manchester United a 2-0 win over Everton on Saturday, their first Premier League victory in three games and one that will no doubt fan the embers of their top-four hopes.","66","4","4"
"🔊 Lily Gladstone could become the first Indigenous actress to earn a Best Actress award at this year's Oscars.

For more firsts listen to Reuters World News special #Oscars episode now https://reut.rs/3PeKUWT","597","48","30"
"Gucci-owner Kering and Ray-Ban parent EssilorLuxottica are among the suitors for Italian eyewear manufacturer Marcolin, the Financial Times reported on Saturday.","32","3","2"
"Poland's prime minister pledged to reduce a grain surplus on the domestic market at talks with farmers on Saturday, a government official said, but union leaders said they were pressing on with weeks of protests.","43","8","9"
"India on Friday began deporting the first group of Myanmar refugees who sought shelter there after a military coup in 2021 and plans to send back more in the coming days, weeks after saying it would end a visa-free border policy with Myanmar.","57","11","11"
"The second-highest official in India's election commission resigned abruptly on Saturday, days ahead of the expected announcement of the date of the country's upcoming general election.","16","2","1"
"'They came on motorcycles carrying guns, with some of them wearing military uniforms,' 13-year-old Aminu Abdullahi said. Aminu was at school in Nigeria's Kaduna state when the gunmen arrived. Authorities and parents say more than 300 children were abducted https://reut.rs/48HJ73D","74","14","12"
"Arsenal goalkeeper Aaron Ramsdale's consistency should earn him a place in Gareth Southgate's squad for the European Championship in Germany, Arsenal manager Mikel Arteta said ahead of Saturday's Premier League meeting with Brentford.","42","7","1"
"Pramac Racing's Jorge Martin took pole position for the MotoGP season-opening Qatar Grand Prix after he smashed the lap record at the Lusail International Circuit on Saturday.","40","18","2"
"OpenAI Chief Executive Sam Altman will return to the ChatGPT-maker's board along with three new directors https://reut.rs/3TtwWTD","70","8","12"
"A suspected drug trafficker and former associate of the late Colombian drugs baron Pablo Escobar has been arrested at his luxury villa in the city of Medellin following an international operation, Spanish police said on Saturday.","46","5","4"
"The US condemned Russia's recent aerial assaults on Ukrainian cities at a UN Security Council meeting, saying the actions violated the UN charter","324","236","25"
"Kering and EssilorLuxottica are among suitors for Marcolin, the Italian manufacturer of Tom Ford’s popular eyewear line, the Financial Times reported on Saturday.","30","9","4"
"Pakistan's former President Asif Ali Zardari won a second term on Saturday, supported by the ruling coalition in a vote by parliament and regional assemblies, the election presiding officer said.","48","17","9"
"Ireland looked set to reject proposals to replace constitutional references to the makeup of a family and women's ""life within the home"" when votes are counted on Saturday, in what would be a significant defeat for the government.","44","12","7"
"Pope Francis has accepted the resignation of a Polish bishop for negligence in handling cases of sexual abuse committed by some clergy against minors, his representatives in the country said on Saturday.","62","33","8"
"India kept up their enviable home record by completing a 4-1 series victory against England on Saturday, and captain Rohit Sharma praised his side's newcomers for their contributions in the absence of several frontline players.","30","2","1"
"Meghan, Britain's Duchess of Sussex, has said she was targeted with ""hateful"" online abuse during her two pregnancies, criticising the toxicity and lack of humanity on the internet and in parts of the media.","218","131","9"
"Millions of vines are being destroyed in Australia and tens of millions more must be pulled up to rein in overproduction that has crushed grape prices and threatened the livelihoods of growers and wine makers https://reut.rs/3TqKE9M","78","11","22"
"Thousands of Spaniards marched through the centre of Madrid on Saturday to protest against an amnesty bill for Catalan separatists involved in a failed 2017 independence bid.","45","11","8"
"Entertainment journalists Lisa Richwine and Rollo Ross join host Kim Vinnell for an inside look at how Tinseltown is gearing up for the Oscars. Listen in as they lift the veil on who's hot and who's not and the challenges facing the global film industry after a tumultuous year.","32","7","4"
"Portugal's criminal police agency PJ said on Saturday it arrested a member of Italy's Camorra crime group who has been on the run for two decades.","49","12","8"
"Abu Dhabi-controlled fresh food producer Unifrutti is expanding its footprint in Latin America with two acquisitions in Peru, building on a previous purchase in the region as the firm eyes continued growth in the fruit market.","129","4","17"
"Senegalese presidential candidates launched their shortened campaigns on Saturday, two days after a court confirmed the election would be held on March 24, ending weeks of uncertainty and kick-starting a competition that remains wide open.","27","3","7"
"A horror film based on the beloved children’s literary character “Winnie the Pooh” faced the vengeance of Razzie voters on Saturday in the annual Oscar spoof that spotlights Hollywood’s worst performances.","104","23","6"
"India is expected to sign an economic agreement on Sunday with a group of four European countries aimed at increasing trade and investment, two officials with knowledge of the talks said, capping nearly 16 years of negotiations.","48","1","9"
"Kyle Kuzma poured in 28 points and Deni Avdija had a big fourth quarter to finish with 18 points as the Washington Wizards ended a 16-game losing streak by defeating the visiting Charlotte Hornets 112-100 on Friday night.","30","2","6"
"A National Guard helicopter assigned to patrol duty along the U.S.-Mexico border crashed in Texas on Friday, killing two soldiers and a U.S. Border Patrol agent who were aboard and injuring another soldier, military officials said.","230","64","19"
"More Americans, including minorities and people considered left of center, are getting ready to survive political upheaval and natural catastrophes, a pursuit largely associated with far-right movements such as white nationalists.","103","83","24"
"Greece’s parliament narrowly passed a bill early on Saturday that will allow foreign private universities to set up branches in the country, bucking weeks of protests by students who say the move will devalue degrees from public universities.","41","12","15"
"Yemen's Iran-aligned Houthis targeted bulk carrier Propel Fortune in the Gulf of Aden, the group's military spokesman Yahya Sarea said in a televised speech early on Saturday.","152","64","9"
"China still faces structural employment issues and overall pressure on jobs has not eased, the human resources minister said on Saturday, as the slowing economy braces for another record number of college graduates in 2024.","29","5","8"
"China's lithium industry would benefit from a stabilisation of prices of the battery metal, which is set for a long-term uptrend, said the chairman of Ganfeng Lithium, a major Chinese supplier of the battery metal.","49","2","8"
"Tottenham Hotspur would never splash out 100 million pounds ($128.57 million) on a single player, manager Ange Postecoglou said ahead of Sunday's Premier League trip to Aston Villa.","41","3","3"
"India grabbed a handy first innings lead of 259 and then reduced England to 103-5 to stay on course for a comprehensive victory in the fifth and final test on Saturday.","37","0","5"
"World number one Iga Swiatek blasted past American Danielle Collins 6-3 6-0, Angelique Kerber upset 10th seed Jelena Ostapenko and defending champion Elena Rybakina withdrew with illness in second round action at Indian Wells on Friday.","49","1","0"
"Replacing manager Pep Guardiola at Manchester City will be a near impossible job compared to getting a new coach at Liverpool at season's end, Juergen Klopp, manager of the latter, said ahead of Sunday's match against title rivals City.","77","15","7"
"The World Bank approved a $350 million loan for Costa Rica to fund infrastructure and climate and disaster resilience projects, the lender said on Friday.","61","5","14"
"A federal judge in Texas on Friday struck down a U.S. National Labor Relations Board (NLRB) rule challenged by major business groups that would treat many companies as employers of certain contract and franchise workers and require them to bargain with unions representing them.","38","4","4"
"Nine people were killed on Friday in a collision between a tractor-trailer truck and a passenger van in central Wisconsin, authorities said.","118","3","10"
"Long-form videos will soon be available on smart televisions, billionaire Elon Musk said, after Fortune magazine reported that social network X planned to launch next week a TV app for Amazon and Samsung users.","105","39","13"
"U.S. Navy ships and aircraft shot down 15 uncrewed aerial vehicle (UAVs) fired by Yemen's Houthis in the Red Sea area early on Saturday, U.S. Central Command (CENTCOM) said.","194","74","21"
"Former heavyweight world champion Anthony Joshua floored Francis Ngannou three times in two rounds at Riyadh's Kingdom Arena on Saturday in a knockout win that put him right back in the reckoning for another title shot.","241","45","9"
"Millions of vines are being destroyed in Australia and tens of millions more must be pulled up to rein in overproduction that has crushed grape prices and threatens the livelihoods of growers and wine makers.","62","5","8"
"India were all out for 477 in reply to England's first innings total of 218 on day three of the fifth and final test on Saturday.","44","3","5"
"Boeing said on Friday it believes required documents detailing the removal of a key part during production of a 737 MAX 9 that failed during a mid-air emergency were never created, according to a letter seen by Reuters.","92","12","9"
"A federal judge in Texas on Friday rejected a challenge by Republican-led states to a Biden administration program that allows hundreds of thousands of migrants from Cuba, Haiti, Nicaragua and Venezuela to apply for emergency entry into the United States.","174","51","13"
"Ratings agency Moody's said on Friday that U.S. hospitals, physician facilities and other medical providers could see a credit impact resulting from disruptions from the hack at UnitedHealth's Change Healthcare, which processes medical insurance claims and payments.","38","3","13"
"Heavy gunfire was seen on Friday near Haiti's national palace in its capital of Port-au-Prince, according to reports by news agency EFE, in the midst of political turmoil sparked by Prime Minister Ariel Henry's absence.","42","5","1"
"The United States is weighing sanctions on several Chinese tech companies, including chipmaker ChangXin Memory Technologies, in a bid to further restrain China's development of advanced semiconductors, Bloomberg News said on Friday.","97","23","15"
"China's consumer prices rose for the first time in six months due to spending linked to the Lunar New Year, offering some reprieve for the world's second-biggest economy grappling with weak consumer sentiment, while factory-gate prices fell again.","37","1","1"
"Guy Philippe, who helped lead a coup in Haiti in 2004 and returned to the Caribbean island last year after serving a prison sentence in the U.S., demanded on Friday that the country's prime minister resign and said he wanted to become president.","92","25","10"
"Oregon Governor Tina Kotek on Friday vowed to sign into law a bill that recriminalizes drug use, more than three years after voters approved the most liberal drug law in the country, one that decriminalized the possession of small amounts of drugs.","127","38","18"
"A group of 12 bipartisan senators said on Friday they are making a new legislative effort to make daylight saving time permanent and end the twice-annual changing of clocks.","136","29","7"
"The Romanian government said on Friday it won an arbitrage trial filed by Canada's Gabriel Resources which wanted compensation after its plan to build Europe's largest open cast gold mine in the western Romanian town of Rosia Montana failed.","40","5","7"
"The University of Miami's shark research and conservation program director, Catherine Macdonald, spearheads research on underwater predators with the goal of promoting science education among young girls.","64","7","8"
"Donald Trump posted a $91.6 million bond to cover the defamation verdict in favor of writer E. Jean Carroll, and began his appeal of the case that arose from his branding her a liar after she accused him of raping her decades ago https://reut.rs/4a2xSUr","131","70","22"
"US President Joe Biden's plan to build a floating US military port to speed up aid to Gaza could take up to 60 days to become a reality and involve more than 1,000 American troops, the Pentagon said https://reut.rs/3v091Sl","243","136","36"
"Tiger Woods will not be competing in the 50th edition of The Players Championship next week as his name did not appear on the field list when it was released after the deadline on Friday.","50","10","2"
"Japan's Teruko Yahata, survivor of an atomic bombing, hopes 'Oppenheimer' will reinvigorate debate over nuclear weapons https://reut.rs/3Pd3zm3","49","4","13"
"The U.S. Coast Guard on Friday was trying to identify the source of an oil spill off the coast of Huntington beach, California, the agency said.","63","4","15"
"Chinese-founded fast-fashion company Shein is set to face stricter EU online content rules after reporting a huge number of users, joining a group of companies that includes Meta Platforms , Alphabet's Google, Elon Musk's X and TikTok.","42","9","16"
"Ukrainian forces have taken up a more defensive stance in many areas of the snow-bound front after a counteroffensive last year was unable to break through heavily-defended Russian lines in the occupied south and east.","156","22","10"
"The U.S. government would be in a stronger legal position if lawmakers ordered China's ByteDance to divest TikTok, rather than simply banning the short video app used by 170 million Americans, the Justice Department told Congress in a document seen by Reuters.","54","36","13"
"FedEx Express pilots have asked the National Mediation Board to release them from mediation with the delivery company, a move that could ramp up pressure for a contract deal by opening the door to a possible strike, their union said on Friday.","41","4","7"
"OpenAI Chief Executive Sam Altman will return to the ChatGPT-maker's board along with three new directors, the world's most prominent artificial intelligence company said on Friday.","51","3","8"
"From the soaring price of bitcoin to inflation numbers from the United States, China and the UK, these are the stories to watch for in business and finance over the coming days.","26","8","6"
"The US Senate will pass spending legislation to fund several federal agencies through September and avert a partial government shutdown that would otherwise begin at midnight, Senate Democratic Leader Chuck Schumer said.","137","25","8"
"Former Honduras President Juan Orlando Hernandez was found guilty on Friday of drug trafficking conspiracy by a U.S. jury, cementing the onetime U.S. ally's fall from grace.","57","11","7"
"From voluminous frocks to modern pantsuits, stylists break down this year's trends and what they expect Hollywood's leading actors will be wearing at #Oscars2024 https://reut.rs/3PfLzY1","36","8","6"
"Tens of thousands of women marched in demonstrations across Spain on Friday to protest against gender inequality and to mark International Women's Day.","137","41","23"
"Seven-year-old Safiya Kuriga complained she was feeling feverish but her mother still made her attend class on Thursday. Within two hours, gunmen entered her school and kidnapped Safiya and some 300 other students in Nigeria's northern Kaduna state.","71","5","9"
"LIVE: US President Joe Biden attends campaign events in Pennsylvania

U.S. President Joe Biden travels to Philadelphia for campaign events, a day after he gave the State of the Union address.
#Live #JoeBiden #Philadelphia #Pennsylvania #SOTU #election #campaign #Reuters #politics #news

Keep up with the latest news from around the world: https://www.reuters.com/","213","0","42"
"A selection of some of our top news photography from around the world this week.","29","5","4"
"El Castillo de la Cenicienta en Walt Disney World en Orlando, Florida, no se ha “quemado hasta los cimientos”, contrario a publicaciones en internet que retoman un contenido de un sitio web satírico.","14","2","2"
"Google has been touting the myriad innovations in its new ‘Bay View’ building, even moving workers in to focus on its highest-profile project: generative artificial intelligence. But, some say they wish the innovations had included decent Wi-Fi https://reut.rs/4a1gTll","32","3","3"
"The U.S. Food and Drug Administration approved Novo Nordisk's weight-loss drug Wegovy on Friday for lowering the risk of stroke and heart attack in overweight or obese adults who are not diabetic.","32","10","9"
"New York Community Bancorp's turnaround will likely take a long time as analysts expect profits to remain under pressure from the lender's efforts to boost reserves for potential bad loans in its commercial real estate portfolio.","19","7","1"
"Israeli settlements in the occupied Palestinian territories have expanded by a record amount and risk eliminating any practical possibly of a Palestinian state, the UN human rights chief said https://reut.rs/3v00YoD","93","45","35"
"Não há evidências de que chá de folha de acerola com alho e limão seja capaz de curar a dengue, como afirma um vídeo no Facebook. Especialistas consultados pela Reuters negaram a alegação. Atualmente, não existe cura comprovada contra a doença, e o tratamento é baseado no alívio dos sintomas.","18","3","2"
"US President Joe Biden renewed his call for a 25% minimum tax on the super wealthy, bitcoin briefly surged to a record high of over $70,000, and more — here's a roundup of the top business and finance stories from this week.","64","10","14"
"A Pentagon report on unidentified flying objects said U.S. government investigations since the end of World War Two have found no evidence of extraterrestrial technology and had concluded that most sightings were misidentified ordinary objects and phenomena.","50","22","6"
"LIVE: Argentine women march on International Women's Day

Argentine women march to mark International Women's Day in Buenos Aires.
 
#InternationalWomensDay #protest #march #IWD #IWD2024
 
Keep up with the latest news from around the world: https://www.reuters.com/","131","1","43"
"Under pressure from European regulators, Apple took a step back in its feud with Epic Games on Friday, clearing the way for Epic to put its own game store on iPhones and iPads in Europe.","17","3","0"
"Beber suco de maçã com inhame não aumenta o número de plaquetas no sangue, como dizem posts nas redes sociais que indicam a mistura para tratar dengue. A bebida pode auxiliar na recuperação da doença porque é hidratante, mas não influencia na contagem plaquetária.","30","1","2"
"Turkish President Tayyip Erdogan said local elections scheduled for March 31 would be his last vote, the state-run Anadolu news agency reported on Friday.","88","17","7"
"Costco's shares were down over 7% on Friday and set for its worst day since May 2022 after the membership-only retail chain missed second-quarter revenue expectations and signaled a negative impact from lower gasoline prices.","59","64","2"
"The world's most famous sled dog race — the Iditarod — got under way with 38 mushers and their canine teams in Anchorage, Alaska","70","5","7"
"Chinese women are increasingly embracing strength sports such as boxing and weightlifting, as society's idea of beauty moves from the long-standing ideal of being 'pale, slim, and youthful' toward a more empowered and individualistic self-image https://reut.rs/3TrQfwp","74","7","9"
"US job growth rose by 275,000 in February, but that likely masks underlying softening labor market conditions as the unemployment rate increased to a two-year high of 3.9% https://reut.rs/4c1fOff","28","6","6"
"Hong Kong published its draft of a new national security law, a document some lawyers said broadened what could be considered sedition and state secrets, with tougher penalties for any one convicted of those crimes and several others https://reut.rs/3v6vsoX","21","2","1"
"Tesla's German plant near Berlin will resume operations next week, the head of its works council said on Friday, after a power outage stopped production.","26","3","4"
"A federal appeals court on Friday revived a lawsuit where investors accused Binance, the world's largest cryptocurrency exchange, of violating U.S. securities laws by selling unregistered tokens that lost much of their value.","20","5","3"
"‘The wall fell on top of me’: 11-year-old Palestinian girl Jamila Khelah, who was pulled from the rubble of a building following an airstrike on Gaza’s Jabalia, recalled her ordeal https://reut.rs/3T87LEK","83","72","11"
"Binance is stopping all transactions and trading in Nigeria's naira amid a countrywide crackdown on cryptocurrency exchanges that authorities blame for feeding a black market for foreign exchange, and more in a roundup of top business stories from Africa https://reut.rs/3IuanI5","18","0","4"
"The U.S. Senate late on Thursday confirmed by voice vote two nominees to fill Republican slots at the Federal Trade Commission.","26","3","4"
"Taiwan Semiconductor Manufacturing Co (TSMC) , the world's largest contract chipmaker, is set to win more than $5 billion in federal grants from the U.S. government for setting up a chipmaking plant in Arizona, Bloomberg News reported on Friday.","55","6","11"
"Jack Black's dumpling obsessed bear is back in the latest instalment of the ""Kung Fu Panda"" franchise after an eight-year hiatus.","63","7","1"
"🔊 The headlines from Reuters World News daily podcast:
- Biden lashes out at Trump in State of the Union speech and orders pier be built in Gaza for aid
- Sweden officially becomes NATO member
- Ireland weighs removing 'a woman's place' from constitution https://reut.rs/3Peu6PQ","574","288","20"
"Argentina's monthly inflation reading likely slowed to 15.3% in February, still painfully high but down sharply from a peak in December, as new libertarian President Javier Milei's austerity drive squeezes shoppers, helping rein in grocery price rises.","41","14","2"
"From Breakingviews - U.S. President Joe Biden’s annual State of the Union address on Thursday evening – both energetic and emphatic – made a strong case that his policies salvaged an economy that had been crushed the pandemic. Distinctly Democratic initiatives were indeed surprisingly effective. The next four years will likely leave less in any president’s control. But having a set of concrete ideas to debate is at le","938","524","28"
"Every spring, China observes the Qingming festival, where families clean the graves of their ancestors. For Jiang Hui, it presents a challenge: how to honor his mother who vanished 10 years ago aboard the missing Malaysia Airlines Flight MH370 https://reut.rs/3P9EHvp","46","7","4"
"Greek students threw petrol bombs at police who responded with tear gas in central Athens on Friday, hours before parliament was expected to pass legislation that will allow foreign private universities to set up branches in the country.","53","14","14"
"French President Emmanuel Macron said that he wants the European Union to guarantee the right to an abortion in its Charter of Fundamental Rights https://reut.rs/3wJiu0O","87","19","12"
