"text","likes","comments","shares"
"A German court is due to rule this week on whether security services can treat the far-right Alternative for Germany and its youth wing as suspected extremist organisations, a decision that could cost the party dearly in upcoming European elections ","48","4","7"
"The trial of Zaniar Matapour, the man accused of conducting a deadly rampage at a gay bar in Oslo in 2022 during the city's annual Pride celebrations, is set to begin on Tuesday ","30","4","5"
"Sunday's #Oscars telecast that honored atomic bomb drama ‘Oppenheimer’ reached a four-year high in viewership with an average audience of roughly 19.5 million on ABC, the Walt Disney-owned network said ","94","23","7"
"US Secretary of State Antony Blinken said the United States would contribute an additional $100 million to a United Nations-backed multinational security force intended to help Haitian police fight gangs and $33 million in humanitarian aid ","74","22","15"
"From Breakingviews - Saying goodbye to Hong Kong will be hard. Luggage-maker Samsonite International , skincare group L'Occitane International and Asian real estate fund manager ESR have emerged as potential buyout targets as stocks languish in the financial hub. These businesses are broadly doing well and could command a higher price tag on another bourse now or later. But that also means shareholders can demand a ge","36","2","1"
"Two separate coal mine accidents have killed 12 people in China over the last 24 hours, state broadcaster CCTV reported, the latest incidents to plague the industry after the government recently revised mining safety legislation https://reut.rs/3Tcx3Se","26","1","1"
"New Zealand's Transport Accident Investigation Commission said it was seizing the cockpit voice recorder and flight data recorder of a LATAM Airlines Boeing 787 after an incident that left more than 50 people injured ","29","2","1"
"President Joe Biden's election-year budget includes raising corporate income tax rate to 28% from 21%, forcing those with wealth of $100 million to pay at least 25% of their income in taxes and letting the government negotiate to bring more drug costs down.","155","27","8"
"New Zealand's Transport Accident Investigation Commission said on Tuesday it was seizing the cockpit voice recorder and flight data recorder of a LATAM Airlines Boeing 787 after an incident that left more than 50 people injured.","25","4","2"
"Yemen's Iran-aligned Houthis targeted what was described as the ""U.S. ship Pinocchio"" in the Red Sea with missiles, according to a speech by the group's military spokesman televised early on Tuesday.","50","33","4"
"Walt Disney responded to billionaire Nelson Peltz and his Trian Fund's campaign to win two board seats with an attack on the activist shareholder's motivations and qualifications in an increasingly bare-knuckled proxy battle ","16","9","3"
"Bitcoin hit a record high on Monday above $72,000, as the biggest cryptocurrency's surge showed no signs of slowing down ","118","52","28"
"Florida and LGBTQ advocates settled a lawsuit over a state law on classroom instruction that grants teachers freedom to discuss sexual orientation and gender identity while also shielding the youngest students from those topics ","49","16","8"
"US presidential candidate Donald Trump said that TikTok was a national security threat but also said that a ban on the popular app would hurt some kids and only strengthen Facebook, which the Republican has harshly criticized ","115","46","13"
"The Kremlin said a call by Pope Francis for talks to end the Ukraine war was ‘quite understandable,’ but NATO's boss said now was not the time to talk about ‘surrender’ ","79","85","10"
"New York Community Bancorp said on Monday it had closed the $1 billion capital infusion deal that was agreed last week with an investor group and plans to submit one-for-three reverse stock split of its common stock to shareholders.","25","5","5"
"Israel was checking whether it had killed Hamas's deputy military leader in an airstrike in Gaza, the Israeli Defense Forces said, as prospects faded for a ceasefire to coincide with the Muslim holy month of Ramadan ","82","94","15"
"Argentina said it will deploy federal security forces to Rosario in Santa Fe to combat a recent upsurge in violence.","28","2","11"
"Pakistani Muslims shopped for last minute food items as the country marked the beginning of the holy month of Ramadan with an evening prayer, known as Tarawih","1430","97","31"
"JPMorgan Chase CEO Jamie Dimon on Tuesday urged the Federal Reserve to wait past June before cutting interest rates, arguing the central bank needs to shore up its inflation-fighting credibility.","35","24","5"
"The S&P 500 and Nasdaq ended down slightly as investors prepared for this week's consumer and producer price data, which they hope will provide a better idea of whether the Federal Reserve can begin cutting interest rates in the coming months https://reut.rs/48Th3KB","16","1","6"
"Helicopters combed an area near the Matterhorn mountain in Switzerland, with hope fading of finding a missing skier, after five other members of the party were found dead after freezing to death in 'catastrophic' conditions https://reut.rs/43b22m9","107","10","14"
"Former Ferrari driver Felipe Massa has taken action in the London High Court against Formula One, former commercial supremo Bernie Ecclestone and the governing FIA seeking recognition as 2008 world champion and financial compensation.","19","1","2"
"Oracle said on Monday it is set to make a joint announcement with chip-giant Nvidia , and it beat estimates for quarterly profit, riding on the generative AI demand boom, sending shares up nearly 14% in extended trading.","35","14","6"
"The UN human rights expert on Russia has said that the death of Kremlin critic Alexei Navalny was Moscow's responsibility as he was either killed in prison or died from detention conditions that amounted to torture https://reut.rs/48QtruE","69","27","17"
"Traders in the U.S. equity options market have grown skittish ahead of Tuesday's release of inflation data that could sway the Federal Reserve's monetary policy trajectory.","17","11","1"
"Plumber by day, breakdancer by night, Cheung Cheuk Man was disappointed to miss out on an Olympic berth when breaking makes its debut at the Paris Games. But he hopes to help develop Hong Kong’s next wave of talent in the dance sport https://reut.rs/3wXcHVm","39","13","5"
"All-Pro left tackle David Bakhtiari announced the end of his 11-season run with the Green Bay Packers on Monday.","27","0","4"
"Israel said it was checking whether Hamas's deputy military leader had been killed in an airstrike in Gaza, which was launched based on intelligence about his location, as prospects faded of a ceasefire to coincide with the Muslim holy month of Ramadan https://reut.rs/3TbQJp5","107","71","18"
"Tyson Foods will permanently close a pork plant in Perry, Iowa, the meatpacker said on Monday, eliminating jobs for about 1,200 workers.","304","239","58"
"Ford Motor will pay $365 million to resolve U.S. allegations it violated a federal tariff law by misclassifying and understating the value of hundreds of thousands of its Transit Connect vehicles.","27","9","3"
"Yemen's port city of Hodeidah and other western coastal areas were hit on Monday by at least 17 airstrikes attributed to a U.S.-British coalition defending ships in the Red Sea, according to Al Masirah, the main Houthi-run television news outlet.","64","37","10"
"Europe moved a step closer to giving so-called gig economy workers at online platforms such as Uber and Deliveroo greater social and labour rights on Monday, although companies said little would change under the watered-down rules.","14","7","1"
"While Joe Biden relied on strong support from Black voters in 2020, some voters now feel disillusioned by the rising cost of living and racial-justice priorities they feel Biden's Democrats have yet to deliver on https://reut.rs/4camTdq","29","19","6"
"Hedge fund Standard General on Monday offered to buy the remaining stake in Bally's Corp that it does not already own in a deal that values the casino operator at about $684 million.","22","3","0"
"President Joe Biden's proposed U.S. government budget would raise tax receipts by $4.951 trillion over 10 years, including more than $2.7 trillion in tax hikes on businesses and nearly $2 trillion on wealthy individuals and estates, the U.S. Treasury said on Monday.","638","330","56"
"Russia will hold a presidential election on March 15-17 with President Vladimir Putin poised to win, barring an unexpected development. A win would give Putin, the longest serving Kremlin chief since Josef Stalin, another six-year term in power https://reut.rs/3wNVCgB","110","52","9"
"U.S. crude oil production lead global oil production for a sixth straight year, with a record breaking average production of 12.9 million barrels per day (bpd), the Energy Information Administration (EIA) said in a release on Monday.","67","18","23"
"US intelligence agencies said the country faces an 'increasingly fragile world order,' strained by great power competition, transnational challenges and regional conflicts, in a report released as agency leaders testified in the Senate.","102","83","14"
"An Australian Shepherd named Viking was crowned best in show at the Crufts dog show in Birmingham.","859","43","52"
"JPMorgan forecast on Monday that Egypt's central bank could hike its key interest rate by another 200 basis points later this month amid signs that inflation was going ""to the moon"" following a bumper currency devaluation.","37","12","4"
"Multiple countries airdropped humanitarian aid into northern Gaza on Monday, the first day of Ramadan, when Muslims around the world will fast during the day https://reut.rs/3TdCWP5","166","107","16"
"US Senator Bob Menendez pleaded not guilty to a new indictment charging him with obstruction of justice, as the embattled Democratic lawmaker's corruption trial draws near https://reut.rs/3Ivv7iC","44","6","10"
"U.S. intelligence agencies said on Monday the country faces an ""increasingly fragile world order,"" strained by great power competition, transnational challenges and regional conflicts, in a report released as agency leaders testified in the U.S. Senate.","80","70","16"
"US President Joe Biden sketched his policy vision for a potential second four-year term, unveiling a $7.3 trillion election-year budget aimed at convincing skeptical Americans that he can run the economy better than Donald Trump.","113","42","6"
"Sam Altman is rejoining the board of ChatGPT-maker OpenAI along with three new directors, as the startup tries to move past his sudden ouster in November that had shocked the tech industry.","19","2","2"
"When a Chinese drone company came under U.S. government scrutiny over its alleged ties to China's military, the company turned to one of America's pre-eminent lawyers: Loretta Lynch, a former attorney general in the Obama administration.","36","17","12"
"Stressed before a big flight? At Istanbul Airport, therapy dogs are now at hand to help calm the nerves of tense travelers https://reut.rs/3TtM17E 🐕","77","3","11"
"Lebanon's Hezbollah group said it carried out a drone attack on Monday against an Israeli air defence outpost across the border in the Israeli-occupied Golan Heights.","91","28","5"
"The Nigerian army searched for nearly 300 students and their armed kidnappers as other recent abductions in the country have torn apart families and communities, who've had to pool their meager savings to pay ransoms https://reut.rs/49OgmDJ","32","10","12"
"An American man is sentenced in Germany to life in prison for the rape and murder of another American tourist and the attempted murder of her friend, also from the US, in a brutal attack near a famous castle outside of Munich
https://reut.rs/43tUyel","55","9","8"
"From Breakingviews - Gas producer EQT’s old management weathered an activist investor outcry, squeaked through an expensive deal, and spun off its pipeline division - only to be ejected by the executives they bought out. Now, new management is putting the pieces back together, on Monday striking a merger with that spinoff, Equitrans Midstream . It’s a sign of how a shifting energy market has upended assumptions behind","43","28","5"
"Several government departments have been the target of computer attacks of ""unprecedented intensity"", French news agency AFP reported, citing sources in the prime minister's office.","28","8","8"
"LIVE: US spy chiefs testify at Senate hearing on worldwide threats

U.S. intelligence agencies testify at the Senate Intelligence Committee annual hearing on worldwide threats to American security.

#reuters #news #live #unitedstates #senate #security

Keep up with the latest news from around the world: https://www.reuters.com/","136","0","52"
"Greta Thunberg and dozens of other environmental campaigners blocked the main entrances to Sweden's parliament on Monday in a sit-down protest against the effects of climate change and what they said was political inaction.","63","18","0"
"Queen Camilla led senior royals at a service at Westminster Abbey marking Commonwealth Day, with King Charles appearing via a pre-recorded video message as he recuperates from cancer treatment https://reut.rs/3wSE431","51","16","5"
"Castelion, a startup trying to build a hypersonic weapon for the Pentagon, tested its system for the first time, it told Reuters on Monday, as a growing group of small hypersonic arms makers challenge large defense contractors with less expensive, rapidly produced products.","124","40","19"
"A fire broke out at Esso-Exxon Mobil's Port Jerome-Gravenchon refinery in northern France on Monday and in-house firefighters were working to bring the blaze under control, the company said.","50","5","9"
"Singapore-based semiconductor firm Silicon Box will invest 3.2 billion euros ($3.50 billion) in a new plant in northern Italy under a government-backed deal, the Italian industry ministry said on Monday.","24","11","4"
"Walt Disney responded on Monday to billionaire Nelson Peltz and his Trian Fund's campaign to win two board seats in a video that attacks the activist shareholder's motivations and qualifications.","21","12","3"
"Reddit aims for a valuation of up to $6.4 billion in its US IPO, the social media platform said, as it nears one of the most-anticipated stock market debuts of the last few years https://reut.rs/49OBl9d","38","6","2"
"India successfully conducted the first flight test of a domestically developed missile with Multiple Independently Targetable Re-entry Vehicle (MIRV) technology, India Prime Minister Narendra Modi said on messaging platform X on Monday.","52","12","6"
"While most people speak only one language or perhaps two, some are proficient in many. These people are called polyglots. And they are helping to provide insight into how the brain deals with language, the principal method of human communication.","69","4","10"
"UN Secretary-General Antonio Guterres released a Ramadan message for all Muslims observing the holy fasting month. Guterres said his thoughts were with those 'suffering from the horrors in Gaza' and who will 'mark this month while facing conflict' https://reut.rs/3wRhQOX","140","73","19"
"Canadian province Alberta's ban on some renewable projects could hurt C$11.1 billion ($8.24 billion) in investments and stall up to 6.3 gigawatts (GW) of solar and wind power capacity, a study said on Monday.","27","27","3"
"Two top Republican senators are introducing legislation on Monday that would require some U.S. government-owned spectrum be auctioned off to boost commercial wireless 5G networks.","18","11","4"
"Argentina's government will launch a huge voluntary debt swap on Monday of peso and some dollar-linked instruments set to mature in 2024, a bid to push back repayments amid a major economic crisis hammering the South American country.","20","5","2"
"Millions in Nigeria, Africa's largest economy, are grappling with the worst cost of living crisis in decades, which deepened since President Bola Tinubu introduced bold but unpopular economic reforms after he assumed office  https://reut.rs/3wSk5S3","35","10","7"
"Cairo received an $8 billion IMF loan after a $35 billion cash injection from the UAE. If President Abdel Fattah al-Sisi doesn't justify the Fund's optimism about reforms, a restructuring of the $165 billion external debt lies ahead, Pierre Briancon says https://reut.rs/49N3LRa","19","1","5"
"LIVE: Humanitarian aid for Gaza being prepared at Cyprus port

A view of a port in Larnaca, Cyprus, where Spanish NGO Open Arms' rescue vessel is being prepared with humanitarian aid for Gaza.
 
#Live #Cyprus #Gaza #OpenArms #NGO #humanitarian #aid #IsrealHamasWar #IsraelGazaWar #Israel #politics #TopStories #Livenews #news #Reuters","83","0","12"
"The U.S. Federal Reserve will cut its key interest rate in June, according to a stronger majority of economists in the latest Reuters poll, as the central bank waits for more data to confirm whether inflation is headed convincingly toward its 2% target.","78","31","8"
"President Joe Biden sketched his policy vision for the United States on Monday, unveiling a $7.3 trillion spending wish list that is as much an election-year pitch to voters as a policy proposal.","150","82","9"
"HSBC is planning to recruit about 50 more bankers in its U.S. commercial bank to lend to startup companies, mainly in the technology and healthcare sectors, according to a senior executive.","36","1","4"
"Contract research firm Fortrea Holdings on Monday said it will sell two of its businesses to private equity firm Arsenal Capital Partners for up to $345 million.","39","0","9"
"Honeywell said it will ask Canada's top court to hear an engine pricing case involving business jet maker Bombardier , in a dispute that has raised concerns among rival planemakers about revealing confidential terms of business negotiations.","17","4","1"
"Somalia's largest market Bakara was hit by its second explosion in just over a month, ripping through dozens of shops and leaving at least one person dead","57","8","4"
"Producer group OPEC and the International Energy Agency, the world's most closely watched forecasters of oil demand growth, are further apart than they have been for at least 16 years in their views on fuel use, according to Reuters research.","26","3","2"
"Kate, Britain's Princess of Wales, issued an apology on social media for ‘any confusion’ caused by an edited photograph which had been issued by her office Kensington Palace https://reut.rs/3Tbs8ku","31","16","5"
"Investors want Zara owner Inditex to follow rivals H&M and Primark in making its full list of suppliers public so they can better assess any supply chain risks https://reut.rs/3TuP5QV","43","5","6"
"A missile-related incident has been reported west of Yemen's Red Sea port city of Hodeidah, British maritime security firm Ambrey said on Monday.","19","6","0"
"Flooding and landslides in the Indonesian province of West Sumatra have killed 26 people and at least six are missing, authorities said on Monday.","26","4","1"
"U.S. Senator Bob Menendez pleaded not guilty on Monday to a new indictment charging him with obstruction of justice, as the embattled Democratic lawmaker's corruption trial draws near.","33","8","2"
"As polls loom ahead, Biden's strength among Black voters nationwide is less certain, as they question Democrats' commitment to voting rights, tackling white supremacy and other issues dear to them
","54","44","9"
"The movie industry celebrated ""Oppenheimer"" and other successes at the Oscars on Sunday, but the coming months at the box office will likely offer less to cheer about.","36","5","1"
"LIVE: Jerusalem cannon fires on sunset announcing end of fasting

A view of the Jerusalem cannon as it fires on sunset announcing the end of fasting for the first day of Ramadan.
 
#Reuters #news #newsfeed #live #Ramadan

Keep up with the latest news from around the world: https://www.reuters.com/","256","0","17"
"U.S. Secretary of State Antony Blinken headed to Jamaica on Monday to attend a Caribbean Community (CARICOM) meeting on Haiti where a collapse in security and a humanitarian crisis in the Caribbean nation has unfolded, the State Department said.","69","41","17"
"The U.S. FDA has declined to approve Viatris and Mapi Pharma's once-a-month injection for treating relapsing forms of debilitating neurological condition multiple sclerosis (MS), the companies said on Monday.","16","1","1"
"An American man was sentenced to life in prison by a German court on Monday for the rape and murder of a tourist and the attempted murder of her friend, both from the U.S., in a brutal attack near the country's most famous tourist destination.","64","31","6"
"Sweden joined NATO in Washington, two years after Russia's invasion of Ukraine forced it to rethink its national security policy and conclude that support for the alliance was the Scandinavian nation's best guarantee of safety https://reut.rs/3v5Cg67","181","56","25"
"The U.S. National Highway Traffic Safety Administration (NHTSA) on Monday launched a preliminary probe into about 250,712 Honda Insight and Honda Passport vehicles over inadvertent activation of automatic emergency braking.","22","2","0"
"LIVE: James Crumbley, father of Michigan high school shooter, on trial for involuntary manslaughter

James Crumbley, 47, faces four counts of involuntary manslaughter for allegedly ignoring warning signs about his son's mental state and not securing the gun that prosecutors say he bought as a Christmas present for his son, Ethan. The teen used the gun in a 2021 shooting, killing four fellow students near Detroit, Michigan. The teen was sentenced to life in prison after pleading guilty to first-degree murder, while his mother, Jennifer Crumbley, was convicted of manslaughter — the first time a parent faced such a charge stemming from a U.S. school shooting by a child.
 
#Live #Michigan #OaklandCounty #JamesCrumbley #schoolshooting #OxfordHighSchool #MichiganFather #EthanCrumbley #JenniferCrumbley #crime #justice #news #Reuters
 
Keep up with the latest news from around the world: https://www.reuters.com/","97","4","8"
"Italian police have arrested three Palestinians based in central Italy who they said were planning attacks in an unspecified country, a police statement said on Monday.","86","45","12"
"Wall Street's main stock indexes dipped on Monday, as investors awaited key inflation data this week that could provide cues on the U.S. Federal Reserve's monetary policy path after a mixed jobs report last week.","29","14","1"
"India announced rules on Monday to implement a 2019 citizenship law that critics call anti-Muslim, weeks before Prime Minister Narendra Modi seeks a rare third term for his Hindu nationalist government.","63","25","8"
"EQT Corp has decided to buy back its former unit Equitrans Midstream in an all-stock deal to create an integrated natural gas provider valued at more than $35 billion, the companies said on Monday.","34","7","2"
"A large grain silo was destroyed in a Russian missile attack on the eastern Ukrainian Dnipro region this weekend and injured one person, the facility's owner Ukrlandfarming said ","92","24","8"
"A Federal Reserve facility launched in haste a year ago amid the heavy stress triggered by Silicon Valley Bank's collapse closes for new business on Monday, amid evidence it helped turn the tide of trouble that risked derailing the economy and upending the central bank’s efforts to lower inflation.","25","5","3"
"🔊 Princess Kate issues an apology after news organizations pull a photo of her and her children.

Find out more on the Reuters World News podcast https://reut.rs/3PDsu2r","70","25","2"
"Several leading news organisations have withdrawn a photograph issued by Kensington Palace of Kate, Britain's Princess of Wales, after post-publication analysis showed it did not meet their editorial standards.","41","21","5"
"US companies are set to announce investments amounting to more than $1 billion dollars in the Philippines, United States Commerce Secretary Gina Raimondo said during an official visit to Manila ","59","10","9"
"Choice Hotels International has terminated its hostile bid for rival Wyndham Hotels & Resorts after failing to gather enough support from the target's shareholders, the company said on Monday.","33","6","2"
"Bitcoin hit a record high above $71,000, as the surge in the biggest cryptocurrency showed no signs of slowing down https://reut.rs/49Mogxm","239","34","107"
"Helicopters were combing an area near the Matterhorn mountain in Switzerland on Monday to find a missing skier after five other members of the party were found dead after ""catastrophic"" conditions.","82","7","6"
"Britain's financial regulator said it will not object to requests from recognized investment exchanges to launch UK-listed crypto asset-backed exchange-traded notes ","13","3","5"
"Summit Carbon Solutions, which is trying to build the biggest carbon dioxide capture pipeline in the United States to transport and bury greenhouse gases, has repeatedly pledged its project will not be used by drillers to boost output from oil fields.","15","2","4"
"‘Oppenheimer,’ the blockbuster biopic about the race to build the first atomic bomb, claimed seven Academy Awards including the prestigious best picture trophy as Hollywood celebrated a triumphant year in film https://reut.rs/3Tv1296","125","5","9"
"Much has changed since Wanda Mosley helped galvanize thousands of Black voters across the battleground state of Georgia to help clinch the 2020 general election for U.S. President Joe Biden.","43","53","0"
